{
  "definitions": {},
  "$schema": "http://json-schema.org/draft-07/schema#",
  "$id": "http://example.com/root.json",
  "type": "array",
  "title": "The Root Schema",
  "items": {
    "$id": "#/items",
    "type": "object",
    "title": "The Items Schema",
    "required": [
      "drugId",
      "personId",
      "visitId",
      "conceptId",
      "startDate",
      "startDatePrecision",
      "endDate",
      "endDatePrecision",
      "strength",
      "doseFormConceptId",
      "doseValue",
      "doseUnitConceptId",
      "numberOfTimes",
      "intervalValue",
      "intervalUnitConceptId",
      "durationValue",
      "durationUnitConceptId",
      "timeOfDayConceptId",
      "asNeeded",
      "typeConceptId"
    ],
    "properties": {
      "drugId": {
        "$id": "#/items/properties/drugId",
        "type": "string",
        "title": "The Drugid Schema",
        "default": "",
        "examples": [
          "e26e8847-dcac-4341-8e4e-30d5aaacf85e"
        ],
        "pattern": "^(.*)$"
      },
      "personId": {
        "$id": "#/items/properties/personId",
        "type": "string",
        "title": "The Personid Schema",
        "default": "",
        "examples": [
          "81163710-c2a2-4750-8e7f-8c7e18575695"
        ],
        "pattern": "^(.*)$"
      },
      "visitId": {
        "$id": "#/items/properties/visitId",
        "type": "string",
        "title": "The Visitid Schema",
        "default": "",
        "examples": [
          "9f974f15-5df4-4c05-9779-f24f500f9cc5"
        ],
        "pattern": "^(.*)$"
      },
      "conceptId": {
        "$id": "#/items/properties/conceptId",
        "type": "string",
        "title": "The Conceptid Schema",
        "default": "",
        "examples": [
          "c67af3b5-cc6d-52d1-9434-221aca948d7b"
        ],
        "pattern": "^(.*)$"
      },
      "startDate": {
        "$id": "#/items/properties/startDate",
        "type": "string",
        "title": "The Startdate Schema",
        "default": "",
        "examples": [
          ""
        ],
        "pattern": "^(.*)$"
      },
      "startDatePrecision": {
        "$id": "#/items/properties/startDatePrecision",
        "type": "string",
        "title": "The Startdateprecision Schema",
        "default": "",
        "examples": [
          ""
        ],
        "pattern": "^(.*)$"
      },
      "endDate": {
        "$id": "#/items/properties/endDate",
        "type": "string",
        "title": "The Enddate Schema",
        "default": "",
        "examples": [
          ""
        ],
        "pattern": "^(.*)$"
      },
      "endDatePrecision": {
        "$id": "#/items/properties/endDatePrecision",
        "type": "string",
        "title": "The Enddateprecision Schema",
        "default": "",
        "examples": [
          ""
        ],
        "pattern": "^(.*)$"
      },
      "strength": {
        "$id": "#/items/properties/strength",
        "type": "string",
        "title": "The Strength Schema",
        "default": "",
        "examples": [
          ""
        ],
        "pattern": "^(.*)$"
      },
      "doseFormConceptId": {
        "$id": "#/items/properties/doseFormConceptId",
        "type": "string",
        "title": "The Doseformconceptid Schema",
        "default": "",
        "examples": [
          ""
        ],
        "pattern": "^(.*)$"
      },
      "doseValue": {
        "$id": "#/items/properties/doseValue",
        "type": "string",
        "title": "The Dosevalue Schema",
        "default": "",
        "examples": [
          ""
        ],
        "pattern": "^(.*)$"
      },
      "doseUnitConceptId": {
        "$id": "#/items/properties/doseUnitConceptId",
        "type": "string",
        "title": "The Doseunitconceptid Schema",
        "default": "",
        "examples": [
          ""
        ],
        "pattern": "^(.*)$"
      },
      "numberOfTimes": {
        "$id": "#/items/properties/numberOfTimes",
        "type": "string",
        "title": "The Numberoftimes Schema",
        "default": "",
        "examples": [
          ""
        ],
        "pattern": "^(.*)$"
      },
      "intervalValue": {
        "$id": "#/items/properties/intervalValue",
        "type": "string",
        "title": "The Intervalvalue Schema",
        "default": "",
        "examples": [
          ""
        ],
        "pattern": "^(.*)$"
      },
      "intervalUnitConceptId": {
        "$id": "#/items/properties/intervalUnitConceptId",
        "type": "string",
        "title": "The Intervalunitconceptid Schema",
        "default": "",
        "examples": [
          ""
        ],
        "pattern": "^(.*)$"
      },
      "durationValue": {
        "$id": "#/items/properties/durationValue",
        "type": "string",
        "title": "The Durationvalue Schema",
        "default": "",
        "examples": [
          ""
        ],
        "pattern": "^(.*)$"
      },
      "durationUnitConceptId": {
        "$id": "#/items/properties/durationUnitConceptId",
        "type": "string",
        "title": "The Durationunitconceptid Schema",
        "default": "",
        "examples": [
          ""
        ],
        "pattern": "^(.*)$"
      },
      "timeOfDayConceptId": {
        "$id": "#/items/properties/timeOfDayConceptId",
        "type": "string",
        "title": "The Timeofdayconceptid Schema",
        "default": "",
        "examples": [
          ""
        ],
        "pattern": "^(.*)$"
      },
      "asNeeded": {
        "$id": "#/items/properties/asNeeded",
        "type": "string",
        "title": "The Asneeded Schema",
        "default": "",
        "examples": [
          ""
        ],
        "pattern": "^(.*)$"
      },
      "typeConceptId": {
        "$id": "#/items/properties/typeConceptId",
        "type": "string",
        "title": "The Typeconceptid Schema",
        "default": "",
        "examples": [
          "a1f9aa3d-7c59-53ea-8131-a77503a16c5e"
        ],
        "pattern": "^(.*)$"
      }
    }
  }
}